{
  "version": 1,
  "id": "engineering-sprint",
  "title": "Engineering Sprint",
  "description": "A realistic sprint board seeded for demos and testing. Includes labels, due dates, a blocked item, comments, and a queue-driven automation.",
  "tags": [
    "demo",
    "engineering",
    "kanban"
  ],
  "steps": [
    {
      "type": "createBoard",
      "alias": "board",
      "name": "DEMO: Engineering Sprint",
      "description": "A realistic sprint board seeded for demos and testing. Includes labels, due dates, a blocked item, and a queue-driven automation."
    },
    {
      "type": "applyStarterPack",
      "board": "board",
      "starterPackId": "board-blueprint-engineering-sprint"
    },
    {
      "type": "createCard",
      "alias": "fixLogin",
      "board": "board",
      "column": "Backlog",
      "title": "Fix: login error state resets unexpectedly",
      "description": "Repro: failed login -> error toast -> retry with correct password -> form clears too early.",
      "dueInDays": 2,
      "labels": [
        "bug",
        "priority-high"
      ]
    },
    {
      "type": "createCard",
      "alias": "refactorApi",
      "board": "board",
      "column": "In Progress",
      "title": "Refactor: consolidate API error mapping",
      "description": "Unify API error payload parsing across views; standardize toast messaging.",
      "dueInDays": 4,
      "labels": [
        "tech-debt"
      ]
    },
    {
      "type": "createCard",
      "alias": "emptyState",
      "board": "board",
      "column": "Review",
      "title": "Add: empty-state guidance for Automations",
      "description": "Help users understand Queue vs Proposals vs Chat. Show 3 copy-paste examples.",
      "labels": [
        "priority-high"
      ]
    },
    {
      "type": "updateCard",
      "board": "board",
      "card": "refactorApi",
      "patch": {
        "isBlocked": true,
        "blockReason": "Waiting on decision: should Queue composer require board selection?"
      }
    },
    {
      "type": "addComment",
      "board": "board",
      "card": "fixLogin",
      "content": "If this regresses again, add an E2E test around login error handling."
    },
    {
      "type": "addComment",
      "board": "board",
      "card": "emptyState",
      "content": "Demo tip: open this card, then show Automations -> Proposals to highlight review/execute."
    },
    {
      "type": "queueInstruction",
      "board": "board",
      "instruction": "create card \"Spike: simulate LLM-driven user\" in column \"Backlog\" with description \"Add an agent runner that creates/moves tasks like a real user.\"",
      "requestAlias": "q1",
      "proposalAlias": "p1"
    }
  ]
}
